{"aggregate":{"cvar95_bps":172.5,"cvar99_bps":175,"cvar_method":"fractional_worst_tail_mean","episode_count":40,"maximum_bps":175,"mean_bps":77.5,"mean_completion_rate":1,"mean_terminal_fraction":0,"median_bps":77.5,"minimum_bps":-20,"minimum_completion_rate":1,"quantile_method":"empirical_nearest_rank","sample_stddev_bps":58.45225972250061,"sample_variance_bps2":3416.6666666666665,"schema_version":"tail-risk-summary-v1","var95_bps":165,"var99_bps":175},"aggregate_episode_count":40,"buy_sell_symmetry_passed":true,"detailed_audit":{"issue_count":0,"issues":[],"passed":true,"schema_version":"metric-audit-v1"},"detailed_episode":{"action_dispatch_latency":{"count":4,"maximum_ns":10,"mean_ns":5.5,"minimum_ns":2,"p50_ns":5,"p95_ns":10,"p99_ns":10},"actions":{"cancels":1,"decisions":4,"invalid_actions":0,"rejected_actions":0,"replaces":1,"submits":3},"adverse_selection":[{"coverage_fraction":1,"directional_cost_bps":60,"directional_cost_quote_atoms":60,"horizon_ns":100,"observed_quantity_lots":100},{"coverage_fraction":0.7,"directional_cost_bps":28.571428571428573,"directional_cost_quote_atoms":20,"horizon_ns":500,"observed_quantity_lots":70}],"aggressive_fraction":0.6,"aggressive_quantity_lots":60,"average_execution_price_quote":100.8,"average_execution_price_ticks":100.8,"benchmarks":[{"benchmark_id":"arrival_price","benchmark_notional_quote_atoms":10000,"implementation_shortfall_bps":83,"implementation_shortfall_quote_atoms":83,"kind":"arrival_price","price_ticks":100},{"benchmark_id":"interval_mid","benchmark_notional_quote_atoms":10100,"implementation_shortfall_bps":-16.831683168316832,"implementation_shortfall_quote_atoms":-17,"kind":"external","price_ticks":101}],"cancel_to_submit_ratio":0.3333333333333333,"complete":true,"completion_rate":1,"controller_latency":{"count":4,"maximum_ns":50,"mean_ns":30,"minimum_ns":10,"p50_ns":20,"p95_ns":50,"p99_ns":50},"episode_id":"detailed-buy","events_per_second":500000,"explicit_fees_quote_atoms":3,"filled_quantity_lots":100,"gross_cash_flow_quote_atoms":-10080,"gross_execution_notional_quote_atoms":10080,"implementation_shortfall_bps":83,"implementation_shortfall_quote_atoms":83,"inference_latency":{"count":3,"maximum_ns":20,"mean_ns":11,"minimum_ns":5,"p50_ns":8,"p95_ns":20,"p99_ns":20},"inventory_trajectory":[{"remaining_lots":100,"timestamp_ns":0},{"remaining_lots":60,"timestamp_ns":100},{"remaining_lots":30,"timestamp_ns":300},{"remaining_lots":10,"timestamp_ns":700},{"remaining_lots":10,"timestamp_ns":1000},{"remaining_lots":0,"timestamp_ns":1100}],"net_cash_flow_quote_atoms":-10083,"observation_staleness":{"count":4,"maximum_ns":100,"mean_ns":55,"minimum_ns":20,"p50_ns":50,"p95_ns":100,"p99_ns":100},"parent_quantity_lots":100,"passive_fraction":0.4,"passive_quantity_lots":40,"performance":{"events_processed":1000,"peak_rss_bytes":8388608,"wall_time_ns":2000000},"remaining_quantity_lots":0,"schema_version":"episode-metrics-v1","side":"buy","terminal_completion_cost_bps":520,"terminal_completion_cost_quote_atoms":52,"terminal_completion_used":true,"terminal_quantity_lots":10,"time_to_complete_ns":1100,"time_to_first_fill_ns":100,"unknown_liquidity_fraction":0,"unknown_liquidity_quantity_lots":0},"detailed_ledger":{"actions":{"cancels":1,"decisions":4,"invalid_actions":0,"rejected_actions":0,"replaces":1,"submits":3},"arrival_price_ticks":100,"decision_timings":[{"action_dispatch_time_ns":112,"decision_end_ns":110,"decision_id":1,"decision_start_ns":100,"inference_latency_ns":5,"observation_cutoff_ns":80},{"action_dispatch_time_ns":325,"decision_end_ns":320,"decision_id":2,"decision_start_ns":300,"inference_latency_ns":8,"observation_cutoff_ns":250},{"action_dispatch_time_ns":745,"decision_end_ns":740,"decision_id":3,"decision_start_ns":700,"inference_latency_ns":null,"observation_cutoff_ns":650},{"action_dispatch_time_ns":1060,"decision_end_ns":1050,"decision_id":4,"decision_start_ns":1000,"inference_latency_ns":20,"observation_cutoff_ns":900}],"end_time_ns":1000,"episode_id":"detailed-buy","external_benchmarks":[{"benchmark_id":"interval_mid","price_ticks":101}],"fills":[{"execution_id":1,"explicit_fee_quote_atoms":-4,"fill_time_ns":100,"liquidity_role":"maker","price_ticks":99,"quantity_lots":40,"source":"continuous"},{"execution_id":2,"explicit_fee_quote_atoms":3,"fill_time_ns":300,"liquidity_role":"taker","price_ticks":101,"quantity_lots":30,"source":"continuous"},{"execution_id":3,"explicit_fee_quote_atoms":2,"fill_time_ns":700,"liquidity_role":"taker","price_ticks":102,"quantity_lots":20,"source":"continuous"},{"execution_id":4,"explicit_fee_quote_atoms":2,"fill_time_ns":1100,"liquidity_role":"taker","price_ticks":105,"quantity_lots":10,"source":"terminal_completion"}],"instrument":{"lot_denominator":1,"lot_numerator":1,"quote_atom_denominator":1,"quote_atom_numerator":1,"tick_denominator":1,"tick_numerator":1},"markouts":[{"execution_id":1,"horizon_ns":100,"markout_mid_price_ticks":98,"markout_time_ns":200},{"execution_id":2,"horizon_ns":100,"markout_mid_price_ticks":102,"markout_time_ns":400},{"execution_id":3,"horizon_ns":100,"markout_mid_price_ticks":100,"markout_time_ns":800},{"execution_id":4,"horizon_ns":100,"markout_mid_price_ticks":104,"markout_time_ns":1200},{"execution_id":1,"horizon_ns":500,"markout_mid_price_ticks":100,"markout_time_ns":600},{"execution_id":2,"horizon_ns":500,"markout_mid_price_ticks":99,"markout_time_ns":800}],"parent_quantity_lots":100,"performance":{"events_processed":1000,"peak_rss_bytes":8388608,"wall_time_ns":2000000},"side":"buy","start_time_ns":0},"deterministic":true,"exact_accounting_passed":true,"historical_results_claimed":false,"incomplete_episode_rejected_from_aggregate":true,"independent_audit_passed":true,"research_status":"synthetic_validation_only_non_research","schema_version":"metrics-validation-v1","state_bounds_passed":true,"step":17,"tail_episodes":[{"episode_id":"tail-0","implementation_shortfall_bps":-20,"terminal_fraction":0},{"episode_id":"tail-1","implementation_shortfall_bps":-15,"terminal_fraction":0},{"episode_id":"tail-2","implementation_shortfall_bps":-10,"terminal_fraction":0},{"episode_id":"tail-3","implementation_shortfall_bps":-5,"terminal_fraction":0},{"episode_id":"tail-4","implementation_shortfall_bps":0,"terminal_fraction":0},{"episode_id":"tail-5","implementation_shortfall_bps":5,"terminal_fraction":0},{"episode_id":"tail-6","implementation_shortfall_bps":10,"terminal_fraction":0},{"episode_id":"tail-7","implementation_shortfall_bps":15,"terminal_fraction":0},{"episode_id":"tail-8","implementation_shortfall_bps":20,"terminal_fraction":0},{"episode_id":"tail-9","implementation_shortfall_bps":25,"terminal_fraction":0},{"episode_id":"tail-10","implementation_shortfall_bps":30,"terminal_fraction":0},{"episode_id":"tail-11","implementation_shortfall_bps":35,"terminal_fraction":0},{"episode_id":"tail-12","implementation_shortfall_bps":40,"terminal_fraction":0},{"episode_id":"tail-13","implementation_shortfall_bps":45,"terminal_fraction":0},{"episode_id":"tail-14","implementation_shortfall_bps":50,"terminal_fraction":0},{"episode_id":"tail-15","implementation_shortfall_bps":55,"terminal_fraction":0},{"episode_id":"tail-16","implementation_shortfall_bps":60,"terminal_fraction":0},{"episode_id":"tail-17","implementation_shortfall_bps":65,"terminal_fraction":0},{"episode_id":"tail-18","implementation_shortfall_bps":70,"terminal_fraction":0},{"episode_id":"tail-19","implementation_shortfall_bps":75,"terminal_fraction":0},{"episode_id":"tail-20","implementation_shortfall_bps":80,"terminal_fraction":0},{"episode_id":"tail-21","implementation_shortfall_bps":85,"terminal_fraction":0},{"episode_id":"tail-22","implementation_shortfall_bps":90,"terminal_fraction":0},{"episode_id":"tail-23","implementation_shortfall_bps":95,"terminal_fraction":0},{"episode_id":"tail-24","implementation_shortfall_bps":100,"terminal_fraction":0},{"episode_id":"tail-25","implementation_shortfall_bps":105,"terminal_fraction":0},{"episode_id":"tail-26","implementation_shortfall_bps":110,"terminal_fraction":0},{"episode_id":"tail-27","implementation_shortfall_bps":115,"terminal_fraction":0},{"episode_id":"tail-28","implementation_shortfall_bps":120,"terminal_fraction":0},{"episode_id":"tail-29","implementation_shortfall_bps":125,"terminal_fraction":0},{"episode_id":"tail-30","implementation_shortfall_bps":130,"terminal_fraction":0},{"episode_id":"tail-31","implementation_shortfall_bps":135,"terminal_fraction":0},{"episode_id":"tail-32","implementation_shortfall_bps":140,"terminal_fraction":0},{"episode_id":"tail-33","implementation_shortfall_bps":145,"terminal_fraction":0},{"episode_id":"tail-34","implementation_shortfall_bps":150,"terminal_fraction":0},{"episode_id":"tail-35","implementation_shortfall_bps":155,"terminal_fraction":0},{"episode_id":"tail-36","implementation_shortfall_bps":160,"terminal_fraction":0},{"episode_id":"tail-37","implementation_shortfall_bps":165,"terminal_fraction":0},{"episode_id":"tail-38","implementation_shortfall_bps":170,"terminal_fraction":0},{"episode_id":"tail-39","implementation_shortfall_bps":175,"terminal_fraction":0}]}
